{
  "schema_version": "1.0",
  "message_id": "0b6f1c9e-4d2a-4f3b-9a1c-2e5d7f8a9b01",
  "session_id": "3f2a9c1e-5b7d-4e8a-9c21-7d4e5f6a8b90",
  "sequence": 42,
  "produced_at": "2026-10-31T01:00:21.050Z",
  "body": {
    "schema_version": "3.0",
    "feature_version": "keypoints-9-v1",
    "baseline": [
      [
        0.5,
        0.4
      ],
      [
        0.52,
        0.38
      ],
      [
        0.48,
        0.38
      ],
      [
        0.54,
        0.4
      ],
      [
        0.46,
        0.4
      ],
      [
        0.51,
        0.43
      ],
      [
        0.49,
        0.43
      ],
      [
        0.6,
        0.6
      ],
      [
        0.4,
        0.6
      ]
    ],
    "frames": [
      {
        "t_ms": 21000,
        "p": [
          [
            0.5,
            0.4,
            0.99
          ],
          [
            0.52,
            0.38,
            0.99
          ],
          [
            0.48,
            0.38,
            0.99
          ],
          [
            0.54,
            0.4,
            0.9
          ],
          [
            0.46,
            0.4,
            0.9
          ],
          [
            0.51,
            0.43,
            0.99
          ],
          [
            0.49,
            0.43,
            0.99
          ],
          [
            0.6,
            0.6,
            0.99
          ],
          [
            0.4,
            0.6,
            0.99
          ]
        ]
      },
      {
        "t_ms": 21100,
        "p": [
          [
            0.55,
            0.4,
            0.99
          ],
          [
            0.52,
            0.38,
            0.99
          ],
          [
            0.48,
            0.38,
            0.99
          ],
          [
            0.5900000000000001,
            0.4,
            0.9
          ],
          [
            0.51,
            0.4,
            0.9
          ],
          [
            0.51,
            0.43,
            0.99
          ],
          [
            0.49,
            0.43,
            0.99
          ],
          [
            0.6,
            0.6,
            0.99
          ],
          [
            0.4,
            0.6,
            0.99
          ]
        ]
      },
      {
        "t_ms": 21200,
        "p": [
          [
            0.54,
            0.4,
            0.99
          ],
          [
            0.52,
            0.38,
            0.99
          ],
          [
            0.48,
            0.38,
            0.99
          ],
          [
            0.54,
            0.4,
            0.9
          ],
          [
            0.46,
            0.4,
            0.9
          ],
          [
            0.51,
            0.43,
            0.99
          ],
          [
            0.49,
            0.43,
            0.99
          ],
          [
            0.6,
            0.6,
            0.99
          ],
          [
            0.4,
            0.6,
            0.99
          ]
        ]
      }
    ]
  }
}
