{
  "schema_version": "1.0",
  "message_id": "7c1d2e3f-4a5b-4c6d-8e7f-9a0b1c2d3e4f",
  "session_id": "3f2a9c1e-5b7d-4e8a-9c21-7d4e5f6a8b90",
  "sequence": 42,
  "produced_at": "2026-10-31T01:00:21.058Z",
  "body": {
    "schema_version": "3.0",
    "model_version": "reference-feature-rule-v1",
    "frames": [
      {
        "t_ms": 21000,
        "valid": true,
        "collapse_probability": 0.0,
        "deviation_type": "none",
        "invalid_reason": null
      },
      {
        "t_ms": 21100,
        "valid": true,
        "collapse_probability": 0.8750000000000009,
        "deviation_type": "left_lean",
        "invalid_reason": null
      },
      {
        "t_ms": 21200,
        "valid": false,
        "collapse_probability": 0.0,
        "deviation_type": "none",
        "invalid_reason": "head_turn"
      }
    ]
  }
}
